Codigo;Valor
8172;OPERADORES DE INSTALAÇÕES PARA PROCESSAMENTO DE MADEIRA
818;OUTROS OPERADORES DE INSTALAÇÕES FIXAS E MÁQUINAS    
8181;OPERADORES DE INSTALAÇÕES DE VIDRARIA E CERÂMICA   
8182;OPERADORES DE MÁQUINAS DE VAPOR E CALDEIRAS
8183;OPERADORES DE MÁQUINAS DE EMBALAGEM, ENGARRAFAMENTO E ETIQUETAGEM
8189;OPERADORES DE MÁQUINAS E DE INSTALAÇÕES FIXAS NÃO CLASSIFICADOS ANTERIORMENTE
82;MONTADORES
821;MONTADORES
8211;MECÂNICOS MONTADORES DE MAQUINARIA MECÂNICA
8212;MONTADORES DE EQUIPAMENTOS ELÉTRICOS E ELETRÔNICOS
8219;MONTADORES NÃO CLASSIFICADOS ANTERIORMENTE
83;CONDUTORES DE VEÍCULOS E OPERADORES DE EQUIPAMENTOS MÓVEIS PESADOS
831;MAQUINISTAS DE LOCOMOTIVAS E AFINS
8311;MAQUINISTAS DE LOCOMOTIVAS 
8312;GUARDA-FREIOS E AGENTES DE MANOBRAS
832;CONDUTORES DE AUTOMÓVEIS, CAMINHONETES E MOTOCICLETAS
8321;CONDUTORES DE MOTOCICLETAS
8322;CONDUTORES DE AUTOMÓVEIS, TAXIS E CAMINHONETES
833;CONDUTORES DE CAMINHÕES PESADOS E ÔNIBUS
8331;CONDUTORES DE ÔNIBUS E BONDES
8332;CONDUTORES DE CAMINHÕES PESADOS
834;OPERADORES DE EQUIPAMENTOS MÓVEIS PESADOS
8341;OPERADORES DE MÁQUINAS AGRÍCOLAS E FLORESTAIS MÓVEIS
8342;OPERADORES DE MÁQUINAS DE MOVIMENTAÇÃO DE TERRAS E AFINS
8343;OPERADORES DE GUINDASTES, GRUAS, APARATOS DE ELEVAÇÃO E AFINS
8344;OPERADORES DE EMPILHADEIRAS
835;MARINHEIROS DE COBERTA E AFINS
8350;MARINHEIROS DE COBERTA E AFINS
9;OCUPAÇÕES ELEMENTARES
91;TRABALHADORES DOMÉSTICOS E OUTROS TRABALHADORES DE LIMPEZA DE INTERIOR DE EDIFÍCIOS
911;TRABALHADORES DOMÉSTICOS E OUTROS TRABALHADORES DE LIMPEZA DE INTERIOR DE EDIFÍCIOS
9111;TRABALHADORES DOS SERVIÇOS DOMÉSTICOS EM GERAL 
9112;TRABALHADORES DE LIMPEZA DE INTERIOR DE EDIFÍCIOS, ESCRITÓRIOS, HOTÉIS E OUTROS ESTABELECIMENTOS
912;LAVADORES DE VEÍCULOS, JANELAS, ROUPAS E OUTRAS LIMPEZAS  MANUAIS
9121;LAVADEIROS DE ROUPAS E PASSADEIROS MANUAIS
9122;LAVADORES DE VEÍCULOS
9123;LIMPADORES DE JANELAS
9129;OUTROS TRABALHADORES DE LIMPEZA
92;TRABALHADORES ELEMENTARES DA AGROPECUÁRIA, DA PESCA E FLORESTAIS 
921;TRABALHADORES ELEMENTARES DA AGROPECUÁRIA, DA PESCA E FLORESTAIS 
9211;TRABALHADORES ELEMENTARES DA AGRICULTURA 
9212;TRABALHADORES ELEMENTARES DA PECUÁRIA 
9213;TRABALHADORES ELEMENTARES DA AGROPECUÁRIA
9214;TRABALHADORES ELEMENTARES DA JARDINAGEM E HORTICULTURA 
9215;TRABALHADORES FLORESTAIS ELEMENTARES
9216;TRABALHADORES ELEMENTARES DA CAÇA, PESCA E AQUICULTURA 
93;TRABALHADORES ELEMENTARES DA MINERAÇÃO, DA CONSTRUÇÃO, DA INDÚSTRIA DE TRANSFORMAÇÃO E DO TRANSPORTE
931;TRABALHADORES ELEMENTARES DA MINERAÇÃO E DA CONSTRUÇÃO
9311;TRABALHADORES ELEMENTARES DE MINAS E PEDREIRAS 
9312;TRABALHADORES ELEMENTARES DE OBRAS PÚBLICAS E DA MANUTENÇÃO DE ESTRADAS, REPRESAS E SIMILARES
9313;TRABALHADORES ELEMENTARES DA CONSTRUÇÃO DE EDIFÍCIOS
932;TRABALHADORES ELEMENTARES DA INDÚSTRIA DE TRANSFORMAÇÃO
9321; EMPACOTADORES MANUAIS
9329;TRABALHADORES ELEMENTARES DA INDÚSTRIA DE TRANSFORMAÇÃO NÃO CLASSIFICADOS ANTERIORMENTE
933;TRABALHADORES ELEMENTARES DO TRANSPORTE E ARMAZENAMENTO
9331;CONDUTORES DE VEÍCULOS ACIONADOS A PEDAL OU A BRAÇOS
9332;CONDUTORES DE VEÍCULOS E MÁQUINAS DE TRAÇÃO ANIMAL
9333;CARREGADORES
9334;REPOSITORES DE PRATELEIRAS
94;AJUDANTES DE PREPARAÇÃO DE ALIMENTOS
941;AJUDANTES DE PREPARAÇÃO DE ALIMENTOS
9411;PREPARADORES DE COMIDAS RÁPIDAS
9412;AJUDANTES DE COZINHA
95;TRABALHADORES AMBULANTES DOS SERVIÇOS E AFINS
951;TRABALHADORES AMBULANTES DOS SERVIÇOS E AFINS
9510;TRABALHADORES AMBULANTES DOS SERVIÇOS E AFINS
952;VENDEDORES AMBULANTES (EXCLUSIVE DE SERVIÇOS DE ALIMENTAÇÃO)
9520;VENDEDORES AMBULANTES (EXCLUSIVE DE SERVIÇOS DE ALIMENTAÇÃO)
96;COLETORES DE LIXO E OUTRAS OCUPAÇÕES ELEMENTARES
961;COLETORES DE LIXO              
9611;COLETORES DE LIXO E MATERIAL RECICLÁVEL
9612;CLASSIFICADORES DE RESÍDUOS
9613;VARREDORES E AFINS
962;OUTRAS OCUPAÇÕES ELEMENTARES
9621;MENSAGEIROS, CARREGADORES DE BAGAGENS E ENTREGADORES DE ENCOMENDAS
9622;PESSOAS QUE REALIZAM VÁRIAS TAREFAS
9623;COLETORES DE DINHEIRO EM MÁQUINAS AUTOMÁTICAS DE VENDA E LEITORES DE MEDIDORES
9624;CARREGADORES DE ÁGUA E COLETORES DE LENHA
9629;OUTRAS OCUPAÇÕES ELEMENTARES NÃO CLASSIFICADAS ANTERIORMENTE
0;MEMBROS DAS FORÇAS ARMADAS, POLICIAIS E BOMBEIROS MILITARES
01;OFICIAIS DAS FORÇAS ARMADAS
011;OFICIAIS DAS FORÇAS ARMADAS
0110;OFICIAIS DAS FORÇAS ARMADAS
02;GRADUADOS E PRAÇAS DAS FORÇAS ARMADAS
021;GRADUADOS E PRAÇAS DAS FORÇAS ARMADAS
0210;GRADUADOS E PRAÇAS DAS FORÇAS ARMADAS
299; MILITARES DAS FORÇAS ARMADAS NÃO ESPECIFICADOS
04;POLICIAIS MILITARES
041;POLICIAIS MILITARES
0411;OFICIAIS DE POLÍCIA MILITAR
0412;GRADUADOS E PRAÇAS DA POLÍCIA MILITAR
05;BOMBEIROS MILITARES
051;BOMBEIROS MILITARES
0511;OFICIAIS DE BOMBEIRO MILITAR
0512;GRADUADOS E PRAÇAS DO CORPO DE BOMBEIROS
599;BOMBEIROS E POLICIAIS MILITARES NÃO ESPECIFICADOS
999;MEMBROS DAS FORÇAS ARMADAS, POLICIAIS E BOMBEIROS MILITARES NÃO ESPECIFICADOS
0000;OCUPAÇÕES MALDEFINIDAS
