Codigo;Valor
1;DIRETORES E GERENTES
11;DIRETORES EXECUTIVOS, DIRIGENTES DA ADMINISTRAÇÃO PÚBLICA E MEMBROS DO PODER EXECUTIVO E LEGISLATIVO
111;MEMBROS SUPERIORES DO PODER EXECUTIVO E LEGISLATIVO
1111;LEGISLADORES 
1112;DIRIGENTES SUPERIORES DA ADMINISTRAÇÃO PÚBLICA
1113;CHEFES DE PEQUENAS POPULAÇÕES
1114;DIRIGENTES DE ORGANIZAÇÕES QUE APRESENTAM UM INTERESSE ESPECIAL
112;DIRETORES GERAIS E GERENTES GERAIS
1120;DIRETORES GERAIS E GERENTES GERAIS
12;DIRIGENTES ADMINISTRATIVOS E COMERCIAIS
121;DIRIGENTES DE ADMINISTRAÇÃO E DE SERVIÇOS
1211;DIRIGENTES FINANCEIROS
1212;DIRIGENTES DE RECURSOS HUMANOS
1213;DIRIGENTES DE POLÍTICAS E PLANEJAMENTO
1219;DIRIGENTES DE ADMINISTRAÇÃO E DE SERVIÇOS NÃO CLASSIFICADOS ANTERIORMENTE
122;DIRIGENTES DE VENDAS, COMERCIALIZAÇÃO E DESENVOLVIMENTO
1221;DIRIGENTES DE VENDAS E  COMERCIALIZAÇÃO 
1222;DIRIGENTES DE PUBLICIDADE E RELAÇÕES PÚBLICAS
1223;DIRIGENTES DE PESQUISA E DESENVOLVIMENTO
13;DIRIGENTES E GERENTES DE PRODUÇÃO E OPERAÇÃO
131;DIRIGENTES DE PRODUÇÃO AGROPECUÁRIA, SILVICULTURA, AQUICULTURA E PESCA
1311;DIRIGENTES DE PRODUÇÃO AGROPECUÁRIA E SILVICULTURA
1312;DIRIGENTES DE PRODUÇÃO DA AQUICULTURA E PESCA
132;DIRIGENTES DE INDÚSTRIA DE TRANSFORMAÇÃO, MINERAÇÃO, CONSTRUÇÃO E DISTRIBUIÇÃO
1321;DIRIGENTES DE INDÚSTRIA DE TRANSFORMAÇÃO
1322;DIRIGENTES DE EXPLORAÇÕES DE MINERAÇÃO
1323;DIRIGENTES DE EMPRESAS DE CONSTRUÇÃO
1324;DIRIGENTES DE EMPRESAS DE ABASTECIMENTO, DISTRIBUIÇÃO E AFINS
133;DIRIGENTES DE SERVIÇOS DE TECNOLOGIA DA INFORMAÇÃO E COMUNICAÇÕES
1330;DIRIGENTES DE SERVIÇOS DE TECNOLOGIA DA INFORMAÇÃO E COMUNICAÇÕES
134;DIRIGENTES E GERENTES DE SERVIÇOS PROFISSIONAIS
1341;DIRIGENTES DE SERVIÇOS DE CUIDADOS INFANTIS
1342;DIRIGENTES DE SERVIÇOS DE SAÚDE
1343;DIRIGENTES DE SERVIÇOS DE CUIDADO A PESSOAS IDOSAS
1344;DIRIGENTES DE SERVIÇOS DE BEM-ESTAR SOCIAL
1345;DIRIGENTES DE SERVIÇOS DE EDUCAÇÃO
1346;GERENTES DE SUCURSAIS DE BANCOS, DE SERVIÇOS FINANCEIROS E DE SEGUROS
1349;DIRIGENTES E GERENTES DE SERVIÇOS PROFISSIONAIS NÃO CLASSIFICADOS ANTERIORMENTE
14;GERENTES DE HOTÉIS, RESTAURANTES, COMÉRCIOS E OUTROS SERVIÇOS
141;GERENTES DE HOTÉIS E RESTAURANTES
1411;GERENTES DE HOTÉIS
1412;GERENTES DE RESTAURANTES
142;GERENTES DE COMÉRCIOS ATACADISTAS E VAREJISTAS
1420;GERENTES DE COMÉRCIOS ATACADISTAS E VAREJISTAS
143;OUTROS GERENTES DE SERVIÇOS
1431;GERENTES DE CENTROS ESPORTIVOS,  DE DIVERSÃO E CULTURAIS
1439;GERENTES DE SERVIÇOS NÃO CLASSIFICADOS ANTERIORMENTE
2;PROFISSIONAIS DAS CIÊNCIAS E INTELECTUAIS
21;PROFISSIONAIS DAS CIÊNCIAS E DA ENGENHARIA
211;FÍSICOS, QUÍMICOS E AFINS
2111;FÍSICOS E ASTRÔNOMOS
2112;METEOROLOGISTAS
2113;QUÍMICOS
2114;GEÓLOGOS E GEOFÍSICOS
212;MATEMÁTICOS, ATUÁRIOS E ESTATÍSTICOS
2120;MATEMÁTICOS, ATUÁRIOS E ESTATÍSTICOS
213;PROFISSIONAIS EM CIÊNCIAS BIOLÓGICAS
2131;BIÓLOGOS, BOTÂNICOS, ZOÓLOGOS E AFINS
2132;AGRÔNOMOS E AFINS
2133;PROFISSIONAIS DA PROTEÇÃO DO MEIO AMBIENTE
214;ENGENHEIROS (EXCLUSIVE ELETROTECNÓLOGOS)
2141;ENGENHEIROS INDUSTRIAIS E DE PRODUÇÃO
2142;ENGENHEIROS CIVIS 
2143;ENGENHEIROS DE MEIO AMBIENTE
2144;ENGENHEIROS MECÂNICOS
2145;ENGENHEIROS QUÍMICOS
2146;ENGENHEIROS DE MINAS, METALÚRGICOS E AFINS
2149;ENGENHEIROS NÃO CLASSIFICADOS ANTERIORMENTE
215;ENGENHEIROS ELETROTÉCNICOS
2151;ENGENHEIROS ELETRICISTAS
2152;ENGENHEIROS ELETRÔNICOS
2153;ENGENHEIROS EM TELECOMUNICAÇÕES
216;ARQUITETOS, URBANISTAS, AGRIMENSORES E DESENHISTAS
2161;ARQUITETOS DE EDIFICAÇÕES
2162;ARQUITETOS PAISAGISTAS
2163;DESENHISTAS DE PRODUTOS E  VESTUÁRIO
2164;URBANISTAS E ENGENHEIROS DE TRÂNSITO
2165;CARTÓGRAFOS E AGRIMENSORES
2166;DESENHISTAS GRÁFICOS E DE MULTIMÍDIA
22;PROFISSIONAIS DA SAÚDE
221;MÉDICOS
2211;MÉDICOS GERAIS
2212;MÉDICOS ESPECIALISTAS
222;PROFISSIONAIS DE ENFERMAGEM E PARTOS
2221;PROFISSIONAIS DE ENFERMAGEM 
2222;PROFISSIONAIS DE PARTOS  
223;PROFISSIONAIS DA MEDICINA TRADICIONAL E ALTERNATIVA
2230;PROFISSIONAIS DA MEDICINA TRADICIONAL E ALTERNATIVA
224;PARAMÉDICOS
2240;PARAMÉDICOS
225;VETERINÁRIOS
2250;VETERINÁRIOS
226;OUTROS PROFISSIONAIS DA SAÚDE
2261;DENTISTAS
2262;FARMACÊUTICOS
2263;PROFISSIONAIS DA SAÚDE E DA HIGIENE LABORAL E AMBIENTAL
2264;FISIOTERAPEUTAS
2265;DIETISTAS E NUTRICIONISTAS
2266;FONOAUDIÓLOGOS
2267;OPTOMETRISTAS
2269;PROFISSIONAIS DA SAÚDE NÃO CLASSIFICADOS ANTERIORMENTE
23;PROFISSIONAIS DO ENSINO 
231;PROFESSORES DE UNIVERSIDADES E DO ENSINO SUPERIOR
2310;PROFESSORES DE UNIVERSIDADES E DO ENSINO SUPERIOR
232;PROFESSORES DE FORMAÇÃO PROFISSIONAL
2320;PROFESSORES DE FORMAÇÃO PROFISSIONAL
233;PROFESSORES DO ENSINO MÉDIO
2330;PROFESSORES DO ENSINO MÉDIO
234;PROFESSORES DO ENSINO FUNDAMENTAL E PRÉ-ESCOLAR
2341;PROFESSORES DO ENSINO FUNDAMENTAL
2342;PROFESSORES DO ENSINO PRÉ-ESCOLAR
235;OUTROS PROFISSIONAIS DO ENSINO 
2351;ESPECIALISTAS EM MÉTODOS PEDAGÓGICOS
2352;EDUCADORES PARA NECESSIDADES ESPECIAIS
2353;OUTROS PROFESSORES DE IDIOMAS
2354;OUTROS PROFESSORES DE MÚSICA
2355;OUTROS PROFESSORES DE ARTES
2356;INSTRUTORES EM TECNOLOGIAS DA INFORMAÇÃO
2359;PROFISSIONAIS DE ENSINO NÃO CLASSIFICADOS ANTERIORMENTE
24;ESPECIALISTAS EM ORGANIZAÇÃO DA ADMINISTRAÇÃO PÚBLICA E DE EMPRESAS
241;ESPECIALISTAS EM FINANÇAS
2411;CONTADORES
2412;ASSESSORES FINANCEIROS E EM INVESTIMENTOS
2413;ANALISTAS FINANCEIROS
242;ESPECIALISTAS EM ORGANIZAÇÃO DE ADMINISTRAÇÃO
2421;ANALISTAS DE GESTÃO E ADMINISTRAÇÃO
2422;ESPECIALISTAS EM POLÍTICAS DE ADMINISTRAÇÃO
2423;ESPECIALISTAS EM POLÍTICAS E SERVIÇOS DE PESSOAL E AFINS
2424;ESPECIALISTAS EM FORMAÇÃO DE PESSOAL
243;PROFISSIONAIS DE VENDAS, COMERCIALIZAÇÃO E RELAÇÕES PÚBLICAS
2431;PROFISSIONAIS DA PUBLICIDADE E DA COMERCIALIZAÇÃO
2432;PROFISSIONAIS DE RELAÇÕES PÚBLICAS
2433;PROFISSIONAIS DE VENDAS TÉCNICAS E MÉDICAS (EXCLUSIVE DE TECNOLOGIA DA INFORMAÇÃO E COMUNICAÇÕES)
2434;PROFISSIONAIS DE VENDAS DE TECNOLOGIA DA INFORMAÇÃO E COMUNICAÇÕES
25;PROFISSIONAIS DE TECNOLOGIAS DA INFORMAÇÃO E COMUNICAÇÕES 
251;DESENVOLVEDORES E ANALISTAS DE PROGRAMAS E APLICATIVOS (SOFTWARE) E MULTIMÍDIA
2511;ANALISTAS DE SISTEMAS
2512;DESENVOLVEDORES DE PROGRAMAS E APLICATIVOS (SOFTWARE) 
2513;DESENVOLVEDORES DE PÁGINAS DE INTERNET (WEB) E MULTIMÍDIA
2514;PROGRAMADORES DE APLICAÇÕES
2519;DESENVOLVEDORES E ANALISTAS DE PROGRAMAS E APLICATIVOS (SOFTWARE) E MULTIMÍDIA NÃO CLASSIFICADOS ANTERIORMENTE
252;ESPECIALISTAS EM BASE DE DADOS E EM REDES DE COMPUTADORES
2521;DESENHISTAS E ADMINISTRADORES DE BASES DE DADOS
2522;ADMINISTRADORES DE SISTEMAS
2523;PROFISSIONAIS EM REDE DE COMPUTADORES
2529;ESPECIALISTAS EM BASE DE DADOS E EM REDES DE COMPUTADORES NÃO CLASSIFICADOS ANTERIORMENTE
26;PROFISSIONAIS  EM DIREITO, EM CIÊNCIAS SOCIAIS E CULTURAIS
261;PROFISSIONAIS EM DIREITO
2611;ADVOGADOS E JURISTAS
2612;JUÍZES
2619;PROFISSIONAIS EM DIREITO NÃO CLASSIFICADOS ANTERIORMENTE
262;ARQUIVOLOGISTAS, CURADORES DE MUSEUS, BIBLIOTECÁRIOS E AFINS
2621;ARQUIVOLOGISTAS E CURADORES DE MUSEUS
2622;BIBLIOTECÁRIOS, DOCUMENTARISTAS E AFINS
263;ESPECIALISTAS EM CIÊNCIAS SOCIAIS E TEOLOGIA
2631;ECONOMISTAS
2632;SOCIÓLOGOS, ANTROPÓLOGOS E AFINS
2633;FILÓSOFOS, HISTORIADORES E ESPECIALISTAS EM CIÊNCIA POLÍTICA
2634;PSICÓLOGOS
2635;ASSISTENTES SOCIAIS
2636;MINISTROS DE CULTOS RELIGIOSOS, MISSIONÁRIOS E AFINS
264;ESCRITORES, JORNALISTAS E LINGUISTAS
2641;ESCRITORES
2642;JORNALISTAS
2643;TRADUTORES, INTÉRPRETES E LINGUISTAS
265;ARTISTAS CRIATIVOS E INTERPRETATIVOS
2651;ARTISTAS PLÁSTICOS
2652;MÚSICOS, CANTORES E COMPOSITORES
2653;BAILARINOS E COREÓGRAFOS
2654;DIRETORES DE CINEMA, DE TEATRO E AFINS
2655;ATORES
2656;LOCUTORES DE RÁDIO, TELEVISÃO E OUTROS MEIOS DE COMUNICAÇÃO
2659;ARTISTAS CRIATIVOS E INTERPRETATIVOS NÃO CLASSIFICADOS ANTERIORMENTE
3;TÉCNICOS E PROFISSIONAIS DE NÍVEL MÉDIO
31;PROFISSIONAIS DE NÍVEL MÉDIO DAS CIÊNCIAS E DA ENGENHARIA 
311;TÉCNICOS EM CIÊNCIAS FÍSICAS E DA ENGENHARIA
3111;TÉCNICOS EM CIÊNCIAS FÍSICAS E QUÍMICAS
3112;TÉCNICOS EM ENGENHARIA CIVIL
3113;ELETROTÉCNICOS
3114;TÉCNICOS EM ELETRÔNICA
3115;TÉCNICOS EM ENGENHARIA MECÂNICA
3116;TÉCNICOS EM QUÍMICA INDUSTRIAL
3117;TÉCNICOS EM ENGENHARIA DE MINAS E METALURGIA
3118;DESENHISTAS E PROJETISTAS TÉCNICOS
3119;TÉCNICOS EM CIÊNCIAS FÍSICAS E DA ENGENHARIA NÃO CLASSIFICADOS ANTERIORMENTE
312;SUPERVISORES EM ENGENHARIA DE MINAS, DE INDÚSTRIAS DE TRANSFORMAÇÃO E DA CONSTRUÇÃO
3121;SUPERVISORES DA MINERAÇÃO
3122;SUPERVISORES DE INDÚSTRIAS DE TRANSFORMAÇÃO
3123;SUPERVISORES DA CONSTRUÇÃO
313;TÉCNICOS EM CONTROLE DE PROCESSOS
3131;OPERADORES DE INSTALAÇÕES DE PRODUÇÃO DE ENERGIA
3132;OPERADORES DE INCINERADORES, INSTALAÇÕES DE TRATAMENTO DE ÁGUA E AFINS
3133;CONTROLADORES DE INSTALAÇÕES DE PROCESSAMENTO DE PRODUTOS QUÍMICOS
3134;OPERADORES DE INSTALAÇÕES DE REFINO DE PETRÓLEO E GÁS NATURAL
3135;CONTROLADORES DE PROCESSOS DE PRODUÇÃO DE METAIS
3139;TÉCNICOS EM CONTROLE DE PROCESSOS NÃO CLASSIFICADOS ANTERIORMENTE
314;TÉCNICOS E PROFISSIONAIS DE NÍVEL MÉDIO EM CIÊNCIAS BIOLÓGICAS E AFINS
3141;TÉCNICOS E PROFISSIONAIS DE NÍVEL MÉDIO EM CIÊNCIAS BIOLÓGICAS (EXCLUSIVE DA MEDICINA)
3142;TÉCNICOS AGROPECUÁRIOS
3143;TÉCNICOS FLORESTAIS
315;TÉCNICOS E CONTROLADORES DA NAVEGAÇÃO MARÍTIMA E AERONÁUTICA
3151;OFICIAIS MAQUINISTAS EM NAVEGAÇÃO
3152;CAPITÃES, OFICIAIS DE COBERTA E PRÁTICOS
3153;PILOTOS DE AVIAÇÃO E AFINS
3154;CONTROLADORES DE TRÁFEGO AÉREO
3155;TÉCNICOS EM SEGURANÇA AERONÁUTICA
32;PROFISSIONAIS DE NÍVEL MÉDIO DA SAÚDE E AFINS
321;TÉCNICOS MÉDICOS E FARMACÊUTICOS
3211;TÉCNICOS EM APARELHOS DE DIAGNÓSTICO E TRATAMENTO MÉDICO
3212;TÉCNICOS DE LABORATÓRIOS MÉDICOS
3213;TÉCNICOS E ASSISTENTES FARMACÊUTICOS
3214;TÉCNICOS DE PRÓTESES MÉDICAS E DENTÁRIAS
322;PROFISSIONAIS DE NÍVEL MÉDIO DE ENFERMAGEM E PARTOS 
3221;PROFISSIONAIS DE NÍVEL MÉDIO DE ENFERMAGEM 
3222;PROFISSIONAIS DE NÍVEL MÉDIO DE PARTOS
323;PROFISSIONAIS DE NÍVEL MÉDIO DE MEDICINA TRADICIONAL E ALTERNATIVA
3230;PROFISSIONAIS DE NÍVEL MÉDIO DE MEDICINA TRADICIONAL E ALTERNATIVA
324;TÉCNICOS E ASSISTENTES VETERINÁRIOS
3240;TÉCNICOS E ASSISTENTES VETERINÁRIOS
325;OUTROS PROFISSIONAIS DE NÍVEL MÉDIO DA SAÚDE
3251;DENTISTAS AUXILIARES E AJUDANTES DE ODONTOLOGIA
3252;TÉCNICOS EM DOCUMENTAÇÃO SANITÁRIA
3253;TRABALHADORES COMUNITÁRIOS DA SAÚDE
3254;TÉCNICOS EM OPTOMETRIA E ÓPTICOS
3255;TÉCNICOS E ASSISTENTES FISIOTERAPEUTAS
3256; ASSISTENTES DE MEDICINA
3257;INSPETORES DE SAÚDE LABORAL, AMBIENTAL E AFINS
3258;AJUDANTES DE AMBULÂNCIAS
3259;PROFISSIONAIS DE NÍVEL MÉDIO DA SAÚDE NÃO CLASSIFICADOS ANTERIORMENTE 
33;PROFISSIONAIS DE NÍVEL MÉDIO EM OPERAÇÕES FINANCEIRAS E ADMINISTRATIVAS
331;PROFISSIONAIS DE NÍVEL MÉDIO EM FINANÇAS E MATEMÁTICA
3311;AGENTES E CORRETORES DE BOLSA, CÂMBIO E OUTROS SERVIÇOS FINANCEIROS
3312;AGENTES DE EMPRÉSTIMOS E FINANCIAMENTO
3313;CONTABILISTAS E GUARDA LIVROS
3314;PROFISSIONAIS DE NÍVEL MÉDIO DE SERVIÇOS ESTATÍSTICOS, MATEMÁTICOS E AFINS
3315;AVALIADORES
332;AGENTES E CORRETORES COMERCIAIS
3321;AGENTES DE SEGUROS
3322;REPRESENTANTES COMERCIAIS
3323;AGENTES DE COMPRAS
3324;CORRETORES DE COMERCIALIZAÇÃO
333;AGENTES DE SERVIÇOS COMERCIAIS
3331;DESPACHANTES ADUANEIROS
3332;ORGANIZADORES DE CONFERÊNCIAS E EVENTOS
3333;AGENTES DE EMPREGO E AGENCIADORES DE MÃO DE OBRA
3334;AGENTES IMOBILIÁRIOS
3339;AGENTES DE SERVIÇOS COMERCIAIS NÃO CLASSIFICADOS ANTERIORMENTE
334;SECRETÁRIOS ADMINISTRATIVOS E ESPECIALIZADOS
3341;SUPERVISORES DE SECRETARIA
3342;SECRETÁRIOS JURÍDICOS
3343;SECRETÁRIOS EXECUTIVOS E ADMINISTRATIVOS
3344;SECRETÁRIOS DE MEDICINA
335;AGENTES DA ADMINISTRAÇÃO PÚBLICA PARA APLICAÇÃO DA LEI E AFINS
3351;AGENTES ADUANEIROS E INSPETORES DE FRONTEIRAS
3352;AGENTES DA ADMINISTRAÇÃO TRIBUTÁRIA
3353;AGENTES DE SERVIÇOS DE SEGURIDADE SOCIAL
3354;AGENTES DE SERVIÇOS DE EXPEDIÇÃO DE LICENÇAS E PERMISSÕES
3355;INSPETORES DE POLÍCIA E DETETIVES
3359;AGENTES DA ADMINISTRAÇÃO PÚBLICA PARA APLICAÇÃO DA LEI E AFINS NÃO CLASSIFICADOS ANTERIORMENTE
34;PROFISSIONAIS DE NÍVEL MÉDIO DE SERVIÇOS JURÍDICOS, SOCIAIS, CULTURAIS E AFINS
341;PROFISSIONAIS DE NÍVEL MÉDIO DE SERVIÇOS JURÍDICOS, SOCIAIS E RELIGIOSOS
3411;PROFISSIONAIS DE NÍVEL MÉDIO DO DIREITO E SERVIÇOS LEGAIS E AFINS
3412;TRABALHADORES E ASSISTENTES SOCIAIS DE NÍVEL MÉDIO
3413;AUXILIARES LEIGOS DE RELIGIÃO
342;TRABALHADORES DO ESPORTE E CONDICIONAMENTO FÍSICO
3421;ATLETAS E ESPORTISTAS
3422;TREINADORES, INSTRUTORES E ÁRBITROS DE ATIVIDADES ESPORTIVAS
3423;INSTRUTORES DE EDUCAÇÃO FÍSICA E ATIVIDADES RECREATIVAS
343;PROFISSIONAIS DE NÍVEL MÉDIO EM ATIVIDADES CULTURAIS, ARTÍSTICAS E CULINÁRIAS
3431;FOTÓGRAFOS
3432;DESENHISTAS E DECORADORES DE INTERIORES
3433;TÉCNICOS EM GALERIAS DE ARTE, MUSEUS E BIBLIOTECAS
3434;CHEFES DE COZINHA
3435;OUTROS PROFISSIONAIS DE NÍVEL MÉDIO EM ATIVIDADES CULTURAIS E ARTÍSTICAS
35;TÉCNICOS DE NÍVEL MÉDIO DA TECNOLOGIA DA INFORMAÇÃO E DAS COMUNICAÇÕES
351;TÉCNICOS EM OPERAÇÕES DE TECNOLOGIA DA INFORMAÇÃO E DAS COMUNICAÇÕES E ASSISTÊNCIA AO USUÁRIO
3511;TÉCNICOS EM OPERAÇÕES DE TECNOLOGIA DA INFORMAÇÃO E DAS COMUNICAÇÕES 
3512;TÉCNICOS EM ASSISTÊNCIA AO USUÁRIO DE TECNOLOGIA DA INFORMAÇÃO E DAS COMUNICAÇÕES
3513;TÉCNICOS DE REDES E SISTEMAS DE COMPUTADORES
3514;TÉCNICOS DA WEB
352;TÉCNICOS EM TELECOMUNICAÇÕES E RADIODIFUSÃO 
3521;TÉCNICOS DE RADIODIFUSÃO E GRAVAÇÃO AUDIOVISUAL
3522;TÉCNICOS DE ENGENHARIA DE TELECOMUNICAÇÕES
4;TRABALHADORES DE APOIO ADMINISTRATIVO
41;ESCRITURÁRIOS
411;ESCRITURÁRIOS GERAIS
4110;ESCRITURÁRIOS GERAIS
412;SECRETÁRIOS (GERAL)
4120;SECRETÁRIOS (GERAL)
413;OPERADORES DE MÁQUINAS DE ESCRITÓRIO
4131;OPERADORES DE MÁQUINAS DE PROCESSAMENTO DE TEXTO E MECANÓGRAFOS
4132;OPERADORES DE ENTRADA DE DADOS
42;TRABALHADORES DE ATENDIMENTO DIRETO AO PÚBLICO
421;CAIXAS DE BANCO, COBRADORES, PAGADORES E AFINS
4211;CAIXAS DE BANCO E AFINS
4212;COLETORES DE APOSTAS E DE JOGOS
4213;TRABALHADORES EM ESCRITÓRIOS DE EMPRÉSTIMOS E PENHOR
4214;COBRADORES E AFINS
422;TRABALHADORES DE SERVIÇOS DE INFORMAÇÃO AO CLIENTE
4221;TRABALHADORES DE AGÊNCIAS DE VIAGEM
4222;TRABALHADORES DE CENTRAIS DE ATENDIMENTO
4223;TELEFONISTAS
4224;RECEPCIONISTAS DE HOTÉIS
4225;TRABALHADORES DOS SERVIÇOS DE INFORMAÇÕES
4226;RECEPCIONISTAS EM GERAL
4227;ENTREVISTADORES DE PESQUISAS DE MERCADO
4229;TRABALHADORES DE SERVIÇOS DE INFORMAÇÃO AO CLIENTE NÃO CLASSIFICADOS ANTERIORMENTE
43;TRABALHADORES DE CÁLCULOS NUMÉRICOS E ENCARREGADOS DO REGISTRO DE MATERIAIS
431;AUXILIARES CONTÁBEIS E FINANCEIROS
4311;TRABALHADORES DE CONTABILIDADE E CÁLCULO DE CUSTOS
4312;TRABALHADORES DE SERVIÇOS ESTATÍSTICOS, FINANCEIROS E DE SEGUROS
4313;TRABALHADORES ENCARREGADOS DE FOLHA DE PAGAMENTO
432;TRABALHADORES ENCARREGADOS DE REGISTROS DE MATERIAIS E DE TRANSPORTES 
4321;TRABALHADORES DE CONTROLE DE ABASTECIMENTO E ESTOQUES
4322;TRABALHADORES DE SERVIÇOS DE APOIO À PRODUÇÃO
4323;TRABALHADORES DE SERVIÇOS DE TRANSPORTE
44;OUTROS TRABALHADORES DE APOIO ADMINISTRATIVO
441;OUTROS TRABALHADORES DE APOIO ADMINISTRATIVO
4411;TRABALHADORES DE BIBLIOTECAS
4412;TRABALHADORES DE SERVIÇOS DE CORREIOS
4413;CODIFICADORES DE DADOS, REVISORES DE PROVAS DE IMPRESSÃO E AFINS
4414;OUTROS ESCREVENTES
4415;TRABALHADORES DE ARQUIVOS
4416;TRABALHADORES DO SERVIÇO DE PESSOAL
4419;TRABALHADORES DE APOIO ADMINISTRATIVO NÃO CLASSIFICADOS ANTERIORMENTE
5;TRABALHADORES DOS SERVIÇOS, VENDEDORES DOS COMÉRCIOS E MERCADOS
51;TRABALHADORES DOS SERVIÇOS PESSOAIS
511;TRABALHADORES DO SERVIÇO DIRETO AOS PASSAGEIROS
5111;AUXILIARES DE SERVIÇO DE BORDO
5112;FISCAIS E COBRADORES DE TRANSPORTES PÚBLICOS
5113;GUIAS DE TURISMO
512;COZINHEIROS
5120;COZINHEIROS
513;GARÇONS E ATENDENTES DE BAR 
5131;GARÇONS 
5132; ATENDENTES DE BAR
514;CABELEIREIROS, ESPECIALISTAS EM TRATAMENTO DE BELEZA E AFINS
5141;CABELEIREIROS
5142;ESPECIALISTAS EM TRATAMENTO DE BELEZA E AFINS
515;SUPERVISORES DE MANUTENÇÃO E LIMPEZA DE EDIFÍCIOS
5151;SUPERVISORES DE MANUTENÇÃO E LIMPEZA DE EDIFÍCIOS EM ESCRITÓRIOS, HOTÉIS E ESTABELECIMENTOS
5152;GOVERNANTAS E MORDOMOS DOMÉSTICOS 
5153;PORTEIROS E ZELADORES
516;OUTROS TRABALHADORES DE SERVIÇOS PESSOAIS
5161;ASTRÓLOGOS, ADIVINHOS E AFINS
5162;ACOMPANHANTES E CRIADOS PARTICULARES
5163;TRABALHADORES DE FUNERÁRIAS E EMBALSAMADORES
5164;CUIDADORES DE ANIMAIS
5165;INSTRUTORES DE AUTOESCOLA
5168;TRABALHADORES DO SEXO
5169;TRABALHADORES DE SERVIÇOS PESSOAIS NÃO CLASSIFICADOS ANTERIORMENTE
52;VENDEDORES 
521;VENDEDORES DE RUA E POSTOS DE MERCADO
5211;VENDEDORES DE QUIOSQUES E POSTOS DE MERCADOS
5212;VENDEDORES AMBULANTES DE SERVIÇOS DE ALIMENTAÇÃO
522;COMERCIANTES E VENDEDORES DE LOJAS
5221;COMERCIANTES DE LOJAS
5222;SUPERVISORES DE LOJAS
5223;BALCONISTAS E VENDEDORES DE LOJAS
523;CAIXAS E EXPEDIDORES DE BILHETES
5230;CAIXAS E EXPEDIDORES DE BILHETES
524;OUTROS VENDEDORES
5241;MODELOS DE MODA, ARTE E PUBLICIDADE
5242;DEMONSTRADORES DE LOJAS
5243;VENDEDORES A DOMICILIO
5244;VENDEDORES POR TELEFONE
5245;FRENTISTAS DE POSTO DE GASOLINA
5246;BALCONISTAS DOS SERVIÇOS DE ALIMENTAÇÃO
5249;VENDEDORES NÃO CLASSIFICADOS ANTERIORMENTE
53;TRABALHADORES DOS CUIDADOS PESSOAIS
531;CUIDADORES DE CRIANÇAS E AJUDANTES DE PROFESSORES
5311;CUIDADORES DE CRIANÇAS 
5312;AJUDANTES DE PROFESSORES
532;TRABALHADORES DE CUIDADOS PESSOAIS NOS SERVIÇOS DE SAÚDE
5321;TRABALHADORES DE CUIDADOS PESSOAIS EM INSTITUIÇÕES
5322;TRABALHADORES DE CUIDADOS PESSOAIS A DOMICÍLIOS
5329;TRABALHADORES DE CUIDADOS PESSOAIS NOS SERVIÇOS DE SAÚDE NÃO CLASSIFICADOS ANTERIORMENTE
54;TRABALHADORES DOS SERVIÇOS DE PROTEÇÃO E SEGURANÇA
541;TRABALHADORES DOS SERVIÇOS DE PROTEÇÃO E SEGURANÇA
5411;BOMBEIROS
5412;POLICIAIS
5413;GUARDIÕES DE PRESÍDIOS
5414;GUARDAS DE SEGURANÇA
5419;TRABALHADORES DOS SERVIÇOS DE PROTEÇÃO E SEGURANÇA NÃO CLASSIFICADOS ANTERIORMENTE
6;TRABALHADORES QUALIFICADOS DA AGROPECUÁRIA, FLORESTAIS, DA CAÇA E DA PESCA 
61;AGRICULTORES E TRABALHADORES QUALIFICADOS DA AGROPECUÁRIA 
611;AGRICULTORES E TRABALHADORES QUALIFICADOS EM ATIVIDADES DA AGRICULTURA
6111;AGRICULTORES E TRABALHADORES QUALIFICADOS EM ATIVIDADES DA AGRICULTURA (EXCLUSIVE HORTAS, VIVEIROS E JARDINS)
6112;AGRICULTORES E TRABALHADORES QUALIFICADOS NO CULTIVO DE HORTAS, VIVEIROS E JARDINS
6114;AGRICULTORES E TRABALHADORES QUALIFICADOS DE CULTIVOS MISTOS
612;CRIADORES E TRABALHADORES QUALIFICADOS DA PECUÁRIA 
6121;CRIADORES DE GADO E TRABALHADORES QUALIFICADOS DA CRIAÇÃO DE GADO
6122;AVICULTORES E TRABALHADORES QUALIFICADOS DA AVICULTURA
6123;APICULTORES, SERICICULTORES E TRABALHADORES QUALIFICADOS DA APICULTURA E SERICICULTURA
6129;OUTROS CRIADORES E TRABALHADORES QUALIFICADOS DA PECUÁRIA NÃO CLASSIFICADOS ANTERIORMENTE
613;PRODUTORES E TRABALHADORES QUALIFICADOS DE EXPLORAÇÃO AGROPECUÁRIA MISTA 
6130;PRODUTORES E TRABALHADORES QUALIFICADOS DE EXPLORAÇÃO AGROPECUÁRIA MISTA 
62;TRABALHADORES FLORESTAIS QUALIFICADOS, PESCADORES E CAÇADORES
621;TRABALHADORES FLORESTAIS QUALIFICADOS E AFINS
6210;TRABALHADORES FLORESTAIS QUALIFICADOS E AFINS
622;PESCADORES E CAÇADORES
6221;TRABALHADORES DA AQUICULTURA
6224;CAÇADORES
6225;PESCADORES
7;TRABALHADORES QUALIFICADOS, OPERÁRIOS E ARTESÃOS DA CONSTRUÇÃO, DAS ARTES MECÂNICAS E OUTROS OFÍCIOS
71;TRABALHADORES QUALIFICADOS E OPERÁRIOS DA CONSTRUÇÃO EXCLUSIVE ELETRICISTAS
711;TRABALHADORES DA CONSTRUÇÃO CIVIL EM OBRAS ESTRUTURAIS
7111;CONSTRUTORES DE CASAS
7112;PEDREIROS
7113;CANTEIROS, CORTADORES E GRAVADORES DE PEDRAS
7114;TRABALHADORES EM CIMENTO E CONCRETO ARMADO
7115;CARPINTEIROS
7119;OUTROS TRABALHADORES QUALIFICADOS E OPERÁRIOS DA CONSTRUÇÃO NÃO CLASSIFICADOS ANTERIORMENTE
712;TRABALHADORES QUALIFICADOS DA CONSTRUÇÃO (ACABAMENTO)
7121;TELHADORES
7122;APLICADORES DE REVESTIMENTOS CERÂMICOS, PASTILHAS, PEDRAS E MADEIRAS
7123;GESSEIROS
7124;INSTALADORES DE MATERIAL ISOLANTE TÉRMICO E ACÚSTICO
7125;VIDRACEIROS
7126;BOMBEIROS E ENCANADORES
7127;MECÂNICOS-INSTALADORES DE SISTEMAS DE REFRIGERAÇÃO E CLIMATIZAÇÃO
713;PINTORES, LIMPADORES DE FACHADAS E AFINS
7131;PINTORES E EMPAPELADORES
7132;LUSTRADORES
7133;LIMPADORES DE FACHADAS 
72;TRABALHADORES QUALIFICADOS E OPERÁRIOS DA METALURGIA, DA CONSTRUÇÃO MECÂNICA E AFINS
721;MOLDADORES, SOLDADORES, CHAPISTAS, CALDEIREIROS, MONTADORES DE ESTRUTURAS METÁLICAS E AFINS
7211;MOLDADORES DE METAL E MACHEIROS
7212;SOLDADORES E OXICORTADORES
7213;CHAPISTAS E CALDEIREIROS
7214;MONTADORES DE ESTRUTURAS METÁLICAS
7215;APARELHADORES E EMENDADORES DE CABOS
722;FERREIROS, FERRAMENTEIROS E AFINS
7221;FERREIROS E FORJADORES
7222;FERRAMENTEIROS E AFINS
7223;REGULADORES E OPERADORES DE MÁQUINAS-FERRAMENTAS
7224;POLIDORES DE METAIS E AFIADORES DE FERRAMENTAS
723;MECÂNICOS E REPARADORES DE MÁQUINAS
7231;MECÂNICOS E REPARADORES DE VEÍCULOS A MOTOR
7232;MECÂNICOS E REPARADORES DE MOTORES DE AVIÃO
7233;MECÂNICOS E REPARADORES DE MÁQUINAS AGRÍCOLAS E INDUSTRIAIS
7234;REPARADORES DE BICICLETAS E AFINS
73;ARTESÃOS E OPERÁRIOS DAS ARTES GRÁFICAS
731;ARTESÃOS 
7311;MECÂNICOS E REPARADORES DE INSTRUMENTOS DE PRECISÃO
7312;CONFECCIONADORES E AFINADORES DE INSTRUMENTOS MUSICAIS
7313;JOALHEIROS E LAPIDADORES DE GEMAS, ARTESÃOS DE METAIS PRECIOSOS E SEMIPRECIOSOS 
7314;CERAMISTAS E AFINS (PREPARAÇÃO E FABRICAÇÃO)
7315;CORTADORES, POLIDORES, JATEADORES E GRAVADORES DE VIDROS E AFINS 
7316;REDATORES DE CARTAZES, PINTORES DECORATIVOS E GRAVADORES 
7317;ARTESÃOS DE PEDRA, MADEIRA, VIME E MATERIAIS SEMELHANTES
7318;ARTESÃOS DE TECIDOS, COUROS E MATERIAIS SEMELHANTES
7319;ARTESÃOS NÃO CLASSIFICADOS ANTERIORMENTE
732;TRABALHADORES QUALIFICADOS E OPERÁRIOS DAS ARTES GRÁFICAS
7321;TRABALHADORES DA PRÉ-IMPRESSÃO GRÁFICA 
7322;IMPRESSORES
7323;ENCADERNADORES E AFINS
74;TRABALHADORES ESPECIALIZADOS EM ELETRICIDADE E ELETRÔNICA
741;INSTALADORES E REPARADORES DE EQUIPAMENTOS ELÉTRICOS
7411;ELETRICISTAS DE OBRAS E AFINS
7412;MECÂNICOS E AJUSTADORES ELETRICISTAS
7413;INSTALADORES E REPARADORES DE LINHAS ELÉTRICAS
742;INSTALADORES E REPARADORES DE EQUIPAMENTOS ELETRÔNICOS E DE TELECOMUNICAÇÕES
7421;MECÂNICOS E REPARADORES EM ELETRÔNICA
7422;INSTALADORES E REPARADORES EM TECNOLOGIAS DA INFORMAÇÃO E COMUNICAÇÕES
75;OPERÁRIOS E OFICIAIS DE PROCESSAMENTO DE ALIMENTOS, DA MADEIRA, DA CONFECÇÃO E AFINS
751;TRABALHADORES QUALIFICADOS DO PROCESSAMENTO DE ALIMENTOS E AFINS
7511;MAGAREFES E AFINS 
7512;PADEIROS, CONFEITEIROS E AFINS 
7513;TRABALHADORES DA PASTEURIZAÇÃO DO LEITE E FABRICAÇÃO DE LATICÍNIOS E AFINS 
7514;TRABALHADORES DA CONSERVAÇÃO DE FRUTAS, LEGUMES E SIMILARES 
7515;TRABALHADORES DA DEGUSTAÇÃO E CLASSIFICAÇÃO DE ALIMENTOS E BEBIDAS
7516;TRABALHADORES QUALIFICADOS DA PREPARAÇÃO DO FUMO E SEUS PRODUTOS 
752;TRABALHADORES QUALIFICADOS DO TRATAMENTO DA MADEIRA, MARCENEIROS E AFINS
7521;TRABALHADORES DE TRATAMENTO E PREPARAÇÃO DA MADEIRA 
7522;MARCENEIROS E AFINS 
7523;OPERADORES DE MÁQUINAS DE LAVRAR MADEIRA 
753;TRABALHADORES QUALIFICADOS E OPERÁRIOS DA CONFECÇÃO DE ROUPAS, CALÇADOS E ACESSÓRIOS
7531;ALFAIATES, MODISTAS, CHAPELEIROS E PELETEIROS
7532;TRABALHADORES QUALIFICADOS DA PREPARAÇÃO DA CONFECÇÃO DE ROUPAS
7533;COSTUREIROS, BORDADEIROS E AFINS
7534;TAPECEIROS, COLCHOEIROS E AFINS
7535;TRABALHADORES QUALIFICADOS DO TRATAMENTO DE COUROS E PELES
7536;SAPATEIROS E AFINS
754;OUTROS TRABALHADORES QUALIFICADOS E OPERÁRIOS DA INDÚSTRIA E DO ARTESANATO
7541;TRABALHADORES SUBAQUÁTICOS 
7542;DINAMITADORES E DETONADORES
7543;CLASSIFICADORES E PROVADORES DE PRODUTOS (EXCETO DE BEBIDAS E ALIMENTOS)
7544;FUMIGADORES E OUTROS CONTROLADORES DE PRAGAS E ERVAS DANINHAS
7549;OUTROS TRABALHADORES QUALIFICADOS E OPERÁRIOS DA INDÚSTRIA E DO ARTESANATO NÃO CLASSIFICADOS ANTERIORMENTE
8;OPERADORES DE INSTALAÇÕES E MÁQUINAS E MONTADORES
81;OPERADORES DE INSTALAÇÕES FIXAS E MÁQUINAS
811;OPERADORES DE INSTALAÇÕES MINERADORAS E DE EXTRAÇÃO E PROCESSAMENTO DE MINERAIS
8111;MINEIROS E OPERADORES DE MÁQUINAS E DE INSTALAÇÕES EM MINAS E PEDREIRAS
8112;OPERADORES DE INSTALAÇÕES DE PROCESSAMENTO DE MINERAIS E ROCHAS
8113;PERFURADORES E SONDADORES DE POÇOS E AFINS 
8114;OPERADORES DE MÁQUINAS PARA FABRICAR CIMENTO, PEDRAS E OUTROS PRODUTOS MINERAIS
812;OPERADORES DE INSTALAÇÕES DE PROCESSAMENTO E RECOBRIDORAS DE METAIS
8121;OPERADORES DE INSTALAÇÕES DE PROCESSAMENTO DE METAIS
8122;OPERADORES DE MÁQUINAS POLIDORAS, GALVANIZADORAS E RECOBRIDORAS DE METAIS
813;OPERADORES DE INSTALAÇÕES E MÁQUINAS DE PRODUTOS QUÍMICOS E FOTOGRÁFICOS
8131;OPERADORES DE INSTALAÇÕES E MÁQUINAS DE PRODUTOS QUÍMICOS 
8132;OPERADORES DE MÁQUINAS PARA FABRICAR PRODUTOS FOTOGRÁFICOS 
814;OPERADORES DE MÁQUINAS PARA FABRICAR PRODUTOS DE BORRACHA, DE PAPEL E DE MATERIAL PLÁSTICO
8141;OPERADORES DE MÁQUINAS PARA FABRICAR PRODUTOS DE BORRACHA
8142;OPERADORES DE MÁQUINAS PARA FABRICAR PRODUTOS DE MATERIAL PLÁSTICO
8143;OPERADORES DE MÁQUINAS PARA FABRICAR PRODUTOS DE PAPEL 
815;OPERADORES DE MÁQUINAS PARA FABRICAR PRODUTOS DE TÊXTEIS E ARTIGOS DE COURO E PELE
8151;OPERADORES DE MÁQUINAS DE PREPARAÇÃO DE FIBRAS, FIAÇÃO E BOBINAMENTO DE FIOS
8152;OPERADORES DE TEARES E OUTRAS MÁQUINAS DE TECELAGEM
8153;OPERADORES DE MÁQUINAS DE COSTURA
8154;OPERADORES DE MÁQUINAS DE BRANQUEAMENTO, TINGIMENTO E LIMPEZA DE TECIDOS
8155;OPERADORES DE MÁQUINAS DE PROCESSAMENTO DE COUROS E PELES
8156;OPERADORES DE MÁQUINAS PARA FABRICAÇÃO DE CALÇADOS E AFINS
8157;OPERADORES DE MÁQUINAS DE LAVAR, TINGIR E PASSAR ROUPAS
8159;OPERADORES DE MÁQUINAS PARA FABRICAR PRODUTOS TÊXTEIS E ARTIGOS DE COURO E PELE NÃO CLASSIFICADOS ANTERIORMENTE
816;OPERADORES DE MÁQUINAS PARA ELABORAR ALIMENTOS E PRODUTOS AFINS
8160;OPERADORES DE MÁQUINAS PARA ELABORAR ALIMENTOS E PRODUTOS AFINS
817;OPERADORES DE INSTALAÇÕES PARA A PREPARAÇÃO DE PAPEL E DE PROCESSAMENTO DE MADEIRA
8171;OPERADORES DE INSTALAÇÕES PARA A PREPARAÇÃO DE PASTA DE PAPEL E PAPEL
